{
  "$schema": "https://json-schema.org/draft/2020-12/schema",
  "$id": "https://elegy/contracts/schemas/elegy-catalog-entry.schema.json",
  "title": "Elegy Catalog Entry",
  "description": "Marketplace and catalog readiness metadata for a publishable Elegy plugin package. This is a separate discovery/index layer from the portable package authority (elegy-plugin-package/v1).",
  "type": "object",
  "additionalProperties": false,
  "required": ["schemaVersion", "packageId", "version", "publisher", "archiveUrl", "digest", "sourceCommit", "verificationStatus", "license"],
  "properties": {
    "schemaVersion": { "const": "elegy-catalog-entry/v1" },
    "packageId": {
      "type": "string",
      "pattern": "^[A-Za-z0-9._-]+$",
      "description": "Stable package identifier matching the plugin package identity."
    },
    "version": {
      "type": "string",
      "minLength": 1,
      "description": "Semantic or calendar version string for this catalog entry."
    },
    "publisher": {
      "type": "string",
      "minLength": 1,
      "description": "Publisher name or organization identifier."
    },
    "displayName": {
      "type": "string",
      "minLength": 1,
      "description": "Human-readable display name."
    },
    "description": {
      "type": "string",
      "minLength": 1,
      "description": "Short description for catalog discovery."
    },
    "tags": {
      "type": "array",
      "description": "Discovery tags.",
      "items": { "type": "string", "minLength": 1 },
      "uniqueItems": true
    },
    "archiveUrl": {
      "type": "string",
      "format": "uri",
      "description": "Download URL for the published package archive."
    },
    "digest": {
      "type": "object",
      "additionalProperties": false,
      "required": ["algorithm", "value"],
      "properties": {
        "algorithm": {
          "type": "string",
          "enum": ["sha256", "sha512"],
          "description": "Hash algorithm used for the digest."
        },
        "value": {
          "type": "string",
          "minLength": 64,
          "description": "Hex-encoded digest value."
        }
      },
      "description": "Cryptographic digest of the package archive."
    },
    "compatibility": {
      "type": "array",
      "description": "Declared host compatibility entries.",
      "items": {
        "type": "object",
        "additionalProperties": false,
        "required": ["host", "versionRange"],
        "properties": {
          "host": {
            "type": "string",
            "minLength": 1,
            "description": "Target host identifier (e.g. 'holon', 'codex', 'opencode')."
          },
          "versionRange": {
            "type": "string",
            "minLength": 1,
            "description": "Supported version range for the target host."
          },
          "notes": {
            "type": "string",
            "minLength": 1,
            "description": "Optional compatibility notes."
          }
        }
      }
    },
    "license": {
      "type": "string",
      "minLength": 1,
      "description": "SPDX license identifier or license file reference."
    },
    "homepage": {
      "type": "string",
      "format": "uri",
      "description": "Project homepage URL."
    },
    "documentationUri": {
      "type": "string",
      "format": "uri",
      "description": "Documentation URL for this package."
    },
    "sourceRepository": {
      "type": "string",
      "format": "uri",
      "description": "Source repository URL."
    },
    "sourceRef": {
      "type": "string",
      "minLength": 1,
      "description": "Git ref (tag or branch) the package was built from."
    },
    "sourceCommit": {
      "type": "string",
      "pattern": "^[a-f0-9]{40}$",
      "description": "Full source commit SHA this catalog entry was generated from."
    },
    "verificationStatus": {
      "type": "string",
      "enum": ["verified", "unverified", "failed", "pending"],
      "description": "Verification status of the published package against its provenance claims."
    },
    "verificationEvidence": {
      "type": "object",
      "additionalProperties": false,
      "properties": {
        "verifiedAtUtc": {
          "type": "string",
          "format": "date-time",
          "description": "ISO 8601 timestamp of the last successful verification."
        },
        "verifier": {
          "type": "string",
          "minLength": 1,
          "description": "Identifier of the verifier (e.g. CI workflow, maintainer)."
        },
        "evidenceUri": {
          "type": "string",
          "format": "uri",
          "description": "URL to verification evidence (e.g. CI run, attestation log)."
        },
        "notes": {
          "type": "string",
          "minLength": 1,
          "description": "Verification notes."
        }
      },
      "description": "Evidence and metadata from the last verification pass."
    },
    "provenanceRef": {
      "type": "string",
      "minLength": 1,
      "description": "Path or URI to provenance attestation."
    },
    "signatureRefs": {
      "type": "array",
      "description": "Paths or URIs to cryptographic signatures over the package archive. Each entry MUST reference a verifiable signature.",
      "items": {
        "type": "object",
        "additionalProperties": false,
        "required": ["ref", "algorithm", "identity"],
        "properties": {
          "ref": {
            "type": "string",
            "minLength": 1,
            "description": "Path or URI to the signature file."
          },
          "algorithm": {
            "type": "string",
            "minLength": 1,
            "description": "Signature algorithm (e.g. 'ed25519', 'ecdsa-p256-sha256')."
          },
          "identity": {
            "type": "string",
            "minLength": 1,
            "description": "Signer identity (e.g. key fingerprint, certificate subject)."
          }
        }
      },
      "uniqueItems": true
    },
    "publishedAtUtc": {
      "type": "string",
      "format": "date-time",
      "description": "ISO 8601 timestamp when this catalog entry was published."
    },
    "catalogMetadata": {
      "type": "object",
      "additionalProperties": false,
      "properties": {
        "catalogId": {
          "type": "string",
          "minLength": 1,
          "description": "Identifier of the catalog or marketplace this entry targets."
        },
        "entryKind": {
          "type": "string",
          "enum": ["stable", "prerelease", "snapshot"],
          "description": "Stability classification for this catalog entry."
        },
        "replacesEntryId": {
          "type": "string",
          "minLength": 1,
          "description": "Catalog entry ID this entry supersedes."
        }
      },
      "description": "Catalog-level routing metadata (not part of the package contract)."
    }
  }
}
