{
  "schemaVersion": "elegy-catalog-entry/v1",
  "packageId": "elegy-planning",
  "version": "1.6.0",
  "publisher": "elegy-project",
  "displayName": "Elegy Planning",
  "description": "Durable planning authority for goals, roadmaps, plans, work points, and project-run leases.",
  "tags": ["planning", "roadmap", "goals", "work-tracking"],
  "archiveUrl": "https://github.com/Sofreshx/Elegy/releases/download/v1.6.0/elegy-planning-0.1.0-x86_64-pc-windows-msvc.zip",
  "digest": {
    "algorithm": "sha256",
    "value": "0000000000000000000000000000000000000000000000000000000000000000"
  },
  "compatibility": [
    {
      "host": "holon",
      "versionRange": ">=1.0.0"
    },
    {
      "host": "codex",
      "versionRange": ">=1.0.0",
      "notes": "Via elegy plugin export codex projection."
    }
  ],
  "license": "MIT",
  "homepage": "https://github.com/Sofreshx/Elegy",
  "documentationUri": "https://github.com/Sofreshx/Elegy/tree/main/docs/specs/elegy-planning.md",
  "sourceRepository": "https://github.com/Sofreshx/Elegy",
  "sourceRef": "v1.6.0",
  "sourceCommit": "0000000000000000000000000000000000000000",
  "verificationStatus": "unverified",
  "verificationEvidence": {
    "notes": "Pending first verification pass."
  },
  "provenanceRef": "elegy-plugin-package.elegy-planning.provenance.json",
  "signatureRefs": [],
  "publishedAtUtc": "2026-06-17T00:00:00Z",
  "catalogMetadata": {
    "entryKind": "stable"
  }
}
